slug,title,url
"ai-voice-invoicing-2026-standard","AI Voice Invoicing: The 2026 Standard for Tradies","https://smashinvoices.com/blog/ai-voice-invoicing-2026-standard"
"air-conditioning-emergency-call-out-invoice","Air Con Emergency Call-out Invoice: After-Hours Rates, Parts and GST","https://smashinvoices.com/blog/air-conditioning-emergency-call-out-invoice"
"appliance-repair-invoice-template-australia","Appliance Repair Invoice Template Australia: Callout Fee, Labour and Parts","https://smashinvoices.com/blog/appliance-repair-invoice-template-australia"
"arborist-invoice-template-australia","Arborist Invoice Template Australia: Crew Rates, Removal and GST","https://smashinvoices.com/blog/arborist-invoice-template-australia"
"best-quote-and-invoice-software-for-tradies","The 30-Second Quote: Best Quote and Invoice Software for Tradies","https://smashinvoices.com/blog/best-quote-and-invoice-software-for-tradies"
"beyond-chatgpt-dedicated-voice-invoicing","ChatGPT vs Voice Invoicing: Why Dedicated AI Wins for Tradies","https://smashinvoices.com/blog/beyond-chatgpt-dedicated-voice-invoicing"
"builder-owes-you-subcontractor-payment-australia","The Builder Who Owes You — Subcontractor Payment Rights in Australia","https://smashinvoices.com/blog/builder-owes-you-subcontractor-payment-australia"
"built-by-someone-else-tradie-invoicing","Inherited Project Invoicing for Tradies: Complete Guide","https://smashinvoices.com/blog/built-by-someone-else-tradie-invoicing"
"built-for-people-who-dont-type","Why I Built an Invoicing App for People Who Don't Type","https://smashinvoices.com/blog/built-for-people-who-dont-type"
"bulk-goods-wholesaler-quoting-gmail","Bulk Goods Wholesaler Quote Automation in Gmail | SMASH","https://smashinvoices.com/blog/bulk-goods-wholesaler-quoting-gmail"
"can-chatgpt-generate-invoices-tradie-guide","Can ChatGPT Generate an Invoice? The Truth for Tradies","https://smashinvoices.com/blog/can-chatgpt-generate-invoices-tradie-guide"
"can-i-invoice-without-gst-australia","Can I Invoice Without GST in Australia?","https://smashinvoices.com/blog/can-i-invoice-without-gst-australia"
"car-detailing-invoice-template-australia","Car Detailing Invoice Template Australia: Packages, Add-ons and GST","https://smashinvoices.com/blog/car-detailing-invoice-template-australia"
"cleaning-invoice-template-australia","Cleaning Invoice Template Australia: ABN, GST and Line Items","https://smashinvoices.com/blog/cleaning-invoice-template-australia"
"cleaning-services-voice-invoicing-tradie","Cleaning Services Voice Invoicing: 90% Admin Reduction","https://smashinvoices.com/blog/cleaning-services-voice-invoicing-tradie"
"concreter-invoice-template-australia","Concreter Invoice Template Australia: Labour, Concrete Supply and GST","https://smashinvoices.com/blog/concreter-invoice-template-australia"
"customer-approval-portal","What Is a Customer Approval Portal and Why Does It Matter for Sole Traders?","https://smashinvoices.com/blog/customer-approval-portal"
"customer-payment-history-better-tradie","Why Knowing Your Customer's Payment History Makes You a Better Tradie","https://smashinvoices.com/blog/customer-payment-history-better-tradie"
"customer-put-fifty-back-in-purse","She Put the Last $50 Back in Her Purse: What to Do When a Customer Doesn't Pay the Full Amount","https://smashinvoices.com/blog/customer-put-fifty-back-in-purse"
"do-i-need-gst-as-a-sole-trader-australia","Do I Need to Register for GST as a Sole Trader in Australia?","https://smashinvoices.com/blog/do-i-need-gst-as-a-sole-trader-australia"
"dog-grooming-invoice-template-australia","Dog Grooming Invoice Template Australia: Packages, Breed Pricing and GST","https://smashinvoices.com/blog/dog-grooming-invoice-template-australia"
"driveway-concrete-asphalt-voice-invoicing","Driveway and Concrete Invoicing: Capture Forgotten Costs","https://smashinvoices.com/blog/driveway-concrete-asphalt-voice-invoicing"
"electrician-call-out-fee-invoice","Electrician Call-out Fee Invoice: Examples, GST and Emergency Rates","https://smashinvoices.com/blog/electrician-call-out-fee-invoice"
"electrician-invoice-template-australia","Electrician Invoice Template Australia: Licence, GST and Materials","https://smashinvoices.com/blog/electrician-invoice-template-australia"
"eofy-invoicing-checklist-sole-traders-australia","The EOFY Invoicing Checklist for Australian Sole Traders","https://smashinvoices.com/blog/eofy-invoicing-checklist-sole-traders-australia"
"fastest-voice-invoice-generator-gmail","Fastest Voice Invoice Generator for Gmail — One Button, Full Invoice | SMASH","https://smashinvoices.com/blog/fastest-voice-invoice-generator-gmail"
"fastest-way-to-send-invoice-2026","Fastest Way to Send an Invoice in 2026 — 60 Second Demo | SMASH","https://smashinvoices.com/blog/fastest-way-to-send-invoice-2026"
"fencing-gate-balustrade-quoting-gmail","Fencing & Balustrade Quote Automation From Gmail | SMASH","https://smashinvoices.com/blog/fencing-gate-balustrade-quoting-gmail"
"fencing-invoice-template-australia","Fencing Invoice Template Australia: Metre Rates, Gates and GST","https://smashinvoices.com/blog/fencing-invoice-template-australia"
"fergus-alternative-voice-invoicing-tradie","Fergus Alternative: Voice Invoicing for 75% Faster Billing","https://smashinvoices.com/blog/fergus-alternative-voice-invoicing-tradie"
"fly-screen-job","The 20 Seconds That Changed How I Invoice","https://smashinvoices.com/blog/fly-screen-job"
"forgotten-invoices-annual-cost","How Much Is One Forgotten Invoice Actually Costing You Per Year?","https://smashinvoices.com/blog/forgotten-invoices-annual-cost"
"friday-pub-test-batch-invoicing-tradies","The Friday Pub Test: How to Batch Invoice in 30 Seconds","https://smashinvoices.com/blog/friday-pub-test-batch-invoicing-tradies"
"garden-shed-kit-barn-quoting-gmail","Garden Shed & Kit Barn Quote Automation in Gmail | SMASH","https://smashinvoices.com/blog/garden-shed-kit-barn-quoting-gmail"
"gardening-invoice-template-australia","Gardening Invoice Template Australia","https://smashinvoices.com/blog/gardening-invoice-template-australia"
"gmail-email-to-invoice-20-seconds","Turn a Gmail Email Into a Sent Invoice in 20 Seconds | SMASH","https://smashinvoices.com/blog/gmail-email-to-invoice-20-seconds"
"gmail-quickbooks-xero-bridge","Gmail to QuickBooks Bridge — Invoice Without the Dashboard | SMASH","https://smashinvoices.com/blog/gmail-quickbooks-xero-bridge"
"gmail-to-xero-invoice-no-typing","Gmail to Xero Invoice — No Typing, No Tab-Switching | SMASH Chrome Extension","https://smashinvoices.com/blog/gmail-to-xero-invoice-no-typing"
"handyman-invoice-template-australia","Handyman Invoice Template Australia","https://smashinvoices.com/blog/handyman-invoice-template-australia"
"handyman-materials-and-call-out-fees","Handyman Materials and Call-out Fee Invoice Guide","https://smashinvoices.com/blog/handyman-materials-and-call-out-fees"
"handymen-multi-skill-voice-invoicing-tradie","Handymen Multi-Skill Invoicing: One Invoice for All Services","https://smashinvoices.com/blog/handymen-multi-skill-voice-invoicing-tradie"
"hidden-cost-of-invoicing-friction","Hidden Cost of Manual Invoicing & How to Fix | SMASH","https://smashinvoices.com/blog/hidden-cost-of-invoicing-friction"
"how-long-to-send-invoice-after-job-australia","How Long Do You Have to Send an Invoice After Completing a Job in Australia?","https://smashinvoices.com/blog/how-long-to-send-invoice-after-job-australia"
"how-much-losing-uncharged-materials","How Much Do Self-Employed Service Workers Lose on Materials They Forget to Charge For?","https://smashinvoices.com/blog/how-much-losing-uncharged-materials"
"how-to-add-sku-numbers-to-invoice","How to Add SKU Numbers to an Invoice From a Parts List | SMASH","https://smashinvoices.com/blog/how-to-add-sku-numbers-to-invoice"
"how-to-charge-materials-on-a-plumbing-invoice","How to Charge Materials on a Plumbing Invoice","https://smashinvoices.com/blog/how-to-charge-materials-on-a-plumbing-invoice"
"how-to-get-invoices-paid-faster-tradie-secrets","Paid in 48 Hours: How to Get Invoices Paid Faster","https://smashinvoices.com/blog/how-to-get-invoices-paid-faster-tradie-secrets"
"how-to-invoice-appliance-repair-callouts","How to Invoice Appliance Repair Callouts in Australia","https://smashinvoices.com/blog/how-to-invoice-appliance-repair-callouts"
"how-to-invoice-as-a-carpenter-australia","How to Invoice as a Carpenter in Australia","https://smashinvoices.com/blog/how-to-invoice-as-a-carpenter-australia"
"how-to-invoice-as-a-cleaner-australia","How to Invoice as a Cleaner in Australia","https://smashinvoices.com/blog/how-to-invoice-as-a-cleaner-australia"
"how-to-invoice-as-a-gardener-australia","How to Invoice as a Gardener or Landscaper in Australia","https://smashinvoices.com/blog/how-to-invoice-as-a-gardener-australia"
"how-to-invoice-as-a-handyman-australia","How to Invoice as a Handyman in Australia","https://smashinvoices.com/blog/how-to-invoice-as-a-handyman-australia"
"how-to-invoice-as-a-mobile-mechanic-australia","How to Invoice as a Mobile Mechanic in Australia","https://smashinvoices.com/blog/how-to-invoice-as-a-mobile-mechanic-australia"
"how-to-invoice-as-a-painter-australia","How to Invoice as a Painter in Australia","https://smashinvoices.com/blog/how-to-invoice-as-a-painter-australia"
"how-to-invoice-as-a-pest-control-operator-australia","How to Invoice as a Pest Control Operator in Australia","https://smashinvoices.com/blog/how-to-invoice-as-a-pest-control-operator-australia"
"how-to-invoice-as-a-plumber-australia","How to Invoice as a Plumber in Australia","https://smashinvoices.com/blog/how-to-invoice-as-a-plumber-australia"
"how-to-invoice-as-a-sole-trader-australia-complete-guide","How to Invoice as a Sole Trader in Australia — The Complete Guide","https://smashinvoices.com/blog/how-to-invoice-as-a-sole-trader-australia-complete-guide"
"how-to-invoice-as-an-electrician-australia","How to Invoice as an Electrician in Australia","https://smashinvoices.com/blog/how-to-invoice-as-an-electrician-australia"
"how-to-invoice-cctv-and-alarm-installations","How to Invoice CCTV and Alarm Installations in Australia","https://smashinvoices.com/blog/how-to-invoice-cctv-and-alarm-installations"
"how-to-invoice-commercial-cleaning-clients","How to Invoice Commercial Cleaning Clients: Scope, GST and Terms","https://smashinvoices.com/blog/how-to-invoice-commercial-cleaning-clients"
"how-to-invoice-computer-repair-parts-and-labour","How to Invoice Computer Repair Parts and Labour in Australia","https://smashinvoices.com/blog/how-to-invoice-computer-repair-parts-and-labour"
"how-to-invoice-concrete-progress-claims","How to Invoice Progress Claims for Concrete Jobs in Australia","https://smashinvoices.com/blog/how-to-invoice-concrete-progress-claims"
"how-to-invoice-emergency-locksmith-call-outs","How to Invoice Emergency Locksmith Call-outs in Australia","https://smashinvoices.com/blog/how-to-invoice-emergency-locksmith-call-outs"
"how-to-invoice-fencing-by-the-metre","How to Invoice Fencing Jobs by the Metre in Australia","https://smashinvoices.com/blog/how-to-invoice-fencing-by-the-metre"
"how-to-invoice-mobile-car-detailing-packages","How to Invoice Mobile Car Detailing Packages in Australia","https://smashinvoices.com/blog/how-to-invoice-mobile-car-detailing-packages"
"how-to-invoice-mobile-dog-grooming-appointments","How to Invoice Mobile Dog Grooming Appointments in Australia","https://smashinvoices.com/blog/how-to-invoice-mobile-dog-grooming-appointments"
"how-to-invoice-multi-day-painting-jobs","How to Invoice Multi-Day Painting Jobs: Labour, Stages and Cashflow","https://smashinvoices.com/blog/how-to-invoice-multi-day-painting-jobs"
"how-to-invoice-pool-chemical-treatments","How to Invoice Pool Chemical Treatments in Australia","https://smashinvoices.com/blog/how-to-invoice-pool-chemical-treatments"
"how-to-invoice-pool-maintenance-australia","How to Invoice for Pool Maintenance in Australia","https://smashinvoices.com/blog/how-to-invoice-pool-maintenance-australia"
"how-to-invoice-quarterly-pest-treatments","How to Invoice Quarterly Pest Control Treatments: Recurring Invoicing Guide","https://smashinvoices.com/blog/how-to-invoice-quarterly-pest-treatments"
"how-to-invoice-rubbish-removal-tip-fees","How to Invoice Rubbish Removal Tip Fees in Australia","https://smashinvoices.com/blog/how-to-invoice-rubbish-removal-tip-fees"
"how-to-invoice-solar-with-stc-rebates","How to Invoice Solar with STC Rebates: Correct Format and GST","https://smashinvoices.com/blog/how-to-invoice-solar-with-stc-rebates"
"how-to-invoice-switchboard-upgrades","How to Invoice Switchboard Upgrades: Labour, RCDs, GST and Quotes","https://smashinvoices.com/blog/how-to-invoice-switchboard-upgrades"
"how-to-invoice-tiling-labour-and-materials","How to Invoice Tiling Labour and Materials: Floor, Wall and Supply and Install","https://smashinvoices.com/blog/how-to-invoice-tiling-labour-and-materials"
"how-to-invoice-tree-removal-and-stump-grinding","How to Invoice Tree Removal and Stump Grinding in Australia","https://smashinvoices.com/blog/how-to-invoice-tree-removal-and-stump-grinding"
"hvac-air-con-invoice-template-australia","HVAC Invoice Template Australia: Refrigerant, Labour, Parts and GST","https://smashinvoices.com/blog/hvac-air-con-invoice-template-australia"
"i-never-got-it-invoice-dispute","\""I Never Got It\"" — The Three Words That Cost Self-Employed Service Workers Thousands","https://smashinvoices.com/blog/i-never-got-it-invoice-dispute"
"ill-pay-you-next-week-chasing-invoices","\""I'll Pay You Next Week\"" — The Three Mondays That Cost Tradies Thousands","https://smashinvoices.com/blog/ill-pay-you-next-week-chasing-invoices"
"invoice-without-typing","How to Invoice Without Typing a Single Word","https://smashinvoices.com/blog/invoice-without-typing"
"invoicing-app-no-typing","Is There an Invoicing App That Doesn't Require Typing?","https://smashinvoices.com/blog/invoicing-app-no-typing"
"is-voice-invoicing-accurate","Is Voice Invoicing Accurate Enough to Trust?","https://smashinvoices.com/blog/is-voice-invoicing-accurate"
"is-xero-overkill-for-solo-tradies","Is Xero Overkill? The Best Simple Invoice App for Solo Tradies","https://smashinvoices.com/blog/is-xero-overkill-for-solo-tradies"
"it-repair-invoice-template-australia","IT Repair Invoice Template Australia: Callout Fee, Labour and Parts","https://smashinvoices.com/blog/it-repair-invoice-template-australia"
"it-reseller-msp-quote-automation-gmail","MSP & IT Reseller Quote Automation in Gmail | SMASH","https://smashinvoices.com/blog/it-reseller-msp-quote-automation-gmail"
"lawn-mowing-repeat-invoices","Repeat Invoices for Lawn Mowing and Garden Maintenance","https://smashinvoices.com/blog/lawn-mowing-repeat-invoices"
"locksmith-invoice-template-australia","Locksmith Invoice Template Australia: Call-out Fee, Labour and GST","https://smashinvoices.com/blog/locksmith-invoice-template-australia"
"miscellaneous-costing-you","What Is 'Miscellaneous' Actually Costing You? My Dad's 30-Year Mistake","https://smashinvoices.com/blog/miscellaneous-costing-you"
"mobile-mechanic-call-out-fee-invoice","Mobile Mechanic Call-out Fee Invoice Guide","https://smashinvoices.com/blog/mobile-mechanic-call-out-fee-invoice"
"mobile-mechanic-invoice-software-grease-free","Grease on Screen: Mobile Mechanic Invoicing That Actually Works","https://smashinvoices.com/blog/mobile-mechanic-invoice-software-grease-free"
"mobile-mechanic-parts-markup-invoice","Mobile Mechanic Parts Markup Invoice Guide","https://smashinvoices.com/blog/mobile-mechanic-parts-markup-invoice"
"mobile-mechanic-toolkit-voice-to-invoice","The Mobile Mechanic's Toolkit: Why Voice-to-Invoice is a Game Changer","https://smashinvoices.com/blog/mobile-mechanic-toolkit-voice-to-invoice"
"never-send-bank-details-text","Why You Should Never Send Your Bank Details in a Text Message","https://smashinvoices.com/blog/never-send-bank-details-text"
"painter-invoice-template-australia","Painter Invoice Template Australia: Labour, Prep, Materials and GST","https://smashinvoices.com/blog/painter-invoice-template-australia"
"pest-control-invoice-template-australia","Pest Control Invoice Template Australia: Treatments, Chemicals and GST","https://smashinvoices.com/blog/pest-control-invoice-template-australia"
"pest-control-invoicing-gmail-csv-pricing","Pest Control Invoicing From Gmail — Upload CSV Pricing & Quote Instantly | SMASH","https://smashinvoices.com/blog/pest-control-invoicing-gmail-csv-pricing"
"photographer-wedding-quote-gmail-60-seconds","Photographer Quote From Gmail in 60 Seconds — Wedding Enquiry Demo | SMASH","https://smashinvoices.com/blog/photographer-wedding-quote-gmail-60-seconds"
"plumber-call-out-fee-invoice","Plumber Call-out Fee Invoice: Examples, GST and Emergency Rates","https://smashinvoices.com/blog/plumber-call-out-fee-invoice"
"plumbing-invoice-template-australia","Plumbing Invoice Template Australia: Licence, GST and Materials","https://smashinvoices.com/blog/plumbing-invoice-template-australia"
"pool-service-invoice-template-australia","Pool Service Invoice Template Australia: Chemicals, Labour and GST","https://smashinvoices.com/blog/pool-service-invoice-template-australia"
"price-materials-automatically","How to Price Materials Automatically in a Quote Without Looking Anything Up","https://smashinvoices.com/blog/price-materials-automatically"
"print-signage-custom-quote-gmail","Print Shop & Signage Quote Automation From Gmail | SMASH","https://smashinvoices.com/blog/print-signage-custom-quote-gmail"
"property-manager-payment-runaround","The Property Manager Runaround — Why Commercial Clients Pay Last","https://smashinvoices.com/blog/property-manager-payment-runaround"
"quickbooks-estimates-from-gmail","QuickBooks CSV Import Blocked? Gmail Estimate Workaround","https://smashinvoices.com/blog/quickbooks-estimates-from-gmail"
"quickbooks-gmail-chrome-extension-missing","What QuickBooks Doesn't Have for Gmail Invoicing — And the Fix | SMASH","https://smashinvoices.com/blog/quickbooks-gmail-chrome-extension-missing"
"quickbooks-gmail-invoice-shortcut","QuickBooks Gmail Invoice Shortcut — Free Desktop Demo | SMASH","https://smashinvoices.com/blog/quickbooks-gmail-invoice-shortcut"
"quickbooks-gmail-sidebar-tab-switching","Stop Tab-Switching: QuickBooks Sidebar for Gmail — Full Workflow | SMASH","https://smashinvoices.com/blog/quickbooks-gmail-sidebar-tab-switching"
"read-receipts-invoicing","How Read Receipts Changed the Way I Follow Up Invoices","https://smashinvoices.com/blog/read-receipts-invoicing"
"repeat-customer-inconsistent-pricing","The Repeat Customer Who Always Gets Your Cheapest Price (Even When You Don't Offer It)","https://smashinvoices.com/blog/repeat-customer-inconsistent-pricing"
"repeat-invoices-for-cleaners","Repeat Invoices for Cleaners: Weekly Billing Without Re-typing","https://smashinvoices.com/blog/repeat-invoices-for-cleaners"
"rubbish-removal-invoice-template-australia","Rubbish Removal Invoice Template Australia: Load Rates, Tip Fees and GST","https://smashinvoices.com/blog/rubbish-removal-invoice-template-australia"
"scope-creep-tradie-invoice","\""While You're Up There...\"" — The Scope Creep Job That Pays for One and Works for Three","https://smashinvoices.com/blog/scope-creep-tradie-invoice"
"security-installer-invoice-template-australia","Security Installer Invoice Template Australia: Equipment, Cable and GST","https://smashinvoices.com/blog/security-installer-invoice-template-australia"
"service-trade-invoice-gmail-sidebar","End the Sunday Night Admin: Service Pros Invoice From Gmail | SMASH","https://smashinvoices.com/blog/service-trade-invoice-gmail-sidebar"
"shipping-container-quote-builder-gmail","Shipping Container Quote Automation From Gmail | SMASH","https://smashinvoices.com/blog/shipping-container-quote-builder-gmail"
"smash-quickbooks-perfect-invoice-speed-stack","SMASH + QuickBooks: 60-Second Invoicing That Syncs to Your Books","https://smashinvoices.com/blog/smash-quickbooks-perfect-invoice-speed-stack"
"smash-quickbooks-why-tradies-choose-speed","SMASH + QuickBooks: Why Tradies Choose Speed Over Desktop Invoicing","https://smashinvoices.com/blog/smash-quickbooks-why-tradies-choose-speed"
"smash-vs-google-docs-free-invoice-template","SMASH Invoices vs a Free Google Docs Template — The Real Cost of \""Free\","https://smashinvoices.com/blog/smash-vs-google-docs-free-invoice-template"
"smash-vs-invoice2go","SMASH Invoices vs Invoice2go — Which Is Better for Sole Traders?","https://smashinvoices.com/blog/smash-vs-invoice2go"
"smash-vs-tradify-sole-trader","SMASH Invoices vs Tradify — When You Don't Need a Full Platform","https://smashinvoices.com/blog/smash-vs-tradify-sole-trader"
"smash-vs-typing-invoices","SMASH Invoices vs Typing Invoices: What 60 Seconds Really Costs You","https://smashinvoices.com/blog/smash-vs-typing-invoices"
"smash-xero-voice-invoicing-accounting","SMASH + Xero: 60-Second Voice Invoicing That Syncs to Your Books","https://smashinvoices.com/blog/smash-xero-voice-invoicing-accounting"
"solar-installation-invoice-template-australia","Solar Installation Invoice Template Australia: Panels, STC Rebates and GST","https://smashinvoices.com/blog/solar-installation-invoice-template-australia"
"solo-tradies-compete-big-firms-ai-2026","How Solo Tradies Beat Big Firms with AI in 2026 | Voice Invoicing","https://smashinvoices.com/blog/solo-tradies-compete-big-firms-ai-2026"
"stop-admin-sundays-voice-invoicing","Stop Admin Sundays: Voice Invoicing Gives Tradies Weekends Back","https://smashinvoices.com/blog/stop-admin-sundays-voice-invoicing"
"stop-bringing-laptops-to-job-sites","Stop Using Your Laptop on Job Sites: Mobile-First Invoicing Guide","https://smashinvoices.com/blog/stop-bringing-laptops-to-job-sites"
"stop-double-handling-invoicing-on-the-job","Stop Double Handling: Business Efficiency Guide | SMASH","https://smashinvoices.com/blog/stop-double-handling-invoicing-on-the-job"
"stop-using-your-truck-as-an-office","Mobile Invoicing for Contractors on the Go | SMASH","https://smashinvoices.com/blog/stop-using-your-truck-as-an-office"
"sunday-night-invoicing-real-cost","What Is the Real Cost of Sunday Night Invoicing? (It's Not Just Time)","https://smashinvoices.com/blog/sunday-night-invoicing-real-cost"
"tax-deductions-sole-trader-tradie-australia","What Tax Deductions Can Australian Tradies Claim?","https://smashinvoices.com/blog/tax-deductions-sole-trader-tradie-australia"
"the-30000-mistake-accountant-cant-save","The $30,000 Mistake Your Accountant Can't Save You From","https://smashinvoices.com/blog/the-30000-mistake-accountant-cant-save"
"the-60-second-invoice-voice-to-invoice","Voice to Invoice: How Tradies Save 12 Hours a Month in 2026","https://smashinvoices.com/blog/the-60-second-invoice-voice-to-invoice"
"the-car-office-reality-check","Truck Cab Office Reality: Why Mobile Invoicing Works Better","https://smashinvoices.com/blog/the-car-office-reality-check"
"the-cost-of-a-coffee-invoicing-roi","Is Free Invoice Software Actually Free? The True Cost of Admin","https://smashinvoices.com/blog/the-cost-of-a-coffee-invoicing-roi"
"the-paperwork-tax-stop-losing-money","The Paperwork Tax: Stop Losing $20k/Year to Invoicing Friction","https://smashinvoices.com/blog/the-paperwork-tax-stop-losing-money"
"the-verbal-quote-trap","The Verbal Quote Trap — Why \""We Agreed on $350\"" Loses Every Time","https://smashinvoices.com/blog/the-verbal-quote-trap"
"tiler-invoice-template-australia","Tiler Invoice Template Australia: Labour by m², Tiles, Adhesive and GST","https://smashinvoices.com/blog/tiler-invoice-template-australia"
"too-nice-costing-you-money","Why Being \""Too Nice\"" Is Costing Your Trades Business Money","https://smashinvoices.com/blog/too-nice-costing-you-money"
"turf-soil-landscaping-quote-automation","Turf & Landscaping Supply Quote Automation in Gmail | SMASH","https://smashinvoices.com/blog/turf-soil-landscaping-quote-automation"
"ultimate-tradie-tech-stack-voice-first-2026","Ultimate Tradie Tech Stack 2026: Voice-First Business Tools Guide","https://smashinvoices.com/blog/ultimate-tradie-tech-stack-voice-first-2026"
"voice-to-crm-ai-learns-customers","Voice-to-CRM: How AI Invoicing Remembers Your Customers in 2026","https://smashinvoices.com/blog/voice-to-crm-ai-learns-customers"
"voice-to-estimate-build-bids-without-pen","Voice to Estimate: Build Precise Bids Without a Pen","https://smashinvoices.com/blog/voice-to-estimate-build-bids-without-pen"
"voice-to-quote-feature","Voice to Quote: Fast Invoicing for Tradies | SMASH","https://smashinvoices.com/blog/voice-to-quote-feature"
"voice-vs-typing-thumbs-costing-ten-dollars","Voice vs Typing: Stop Paying the $10 Thumb Tax","https://smashinvoices.com/blog/voice-vs-typing-thumbs-costing-ten-dollars"
"wave-invoicing-alternative-gmail","Wave Invoicing Alternative for Gmail — Free Demo (2026) | SMASH","https://smashinvoices.com/blog/wave-invoicing-alternative-gmail"
"what-does-a-good-tradie-business-look-like","What Does a Good Tradie Business Actually Look Like? (The Real Numbers)","https://smashinvoices.com/blog/what-does-a-good-tradie-business-look-like"
"what-happens-no-abn-on-invoice-australia","What Happens If I Don't Have an ABN on My Invoice in Australia?","https://smashinvoices.com/blog/what-happens-no-abn-on-invoice-australia"
"what-is-a-bas-sole-trader-australia","What Is a BAS and When Do Sole Traders Need to Lodge One?","https://smashinvoices.com/blog/what-is-a-bas-sole-trader-australia"
"what-must-be-on-a-tax-invoice-australia","What Must Be On a Tax Invoice in Australia? (The Exact Legal List)","https://smashinvoices.com/blog/what-must-be-on-a-tax-invoice-australia"
"who-is-smash-invoices-for","Who Is SMASH Invoices Actually For? (And Who It's Not)","https://smashinvoices.com/blog/who-is-smash-invoices-for"
