slug,title,url
"why-every-invoicing-app-fails","Why Every Invoicing App Fails Self-Employed Service Workers (and What to Do Instead)","https://smashinvoices.com/blog/why-every-invoicing-app-fails"
"why-i-deleted-my-invoice-spreadsheet","The Night I Deleted Excel: Why Spreadsheets are a Small Business Trap","https://smashinvoices.com/blog/why-i-deleted-my-invoice-spreadsheet"
"why-invoicing-apps-fail-mobile-test","Why Mobile Invoicing Apps Fail: The 5-Point Mobile Test","https://smashinvoices.com/blog/why-invoicing-apps-fail-mobile-test"
"why-trades-businesses-fail-year-3","Why Trades Businesses Fail in Year 3 (It's Not the Work)","https://smashinvoices.com/blog/why-trades-businesses-fail-year-3"
"why-tradies-hate-phones-for-admin","Easy Invoicing for Tradespeople on Job Sites | SMASH","https://smashinvoices.com/blog/why-tradies-hate-phones-for-admin"
"word-vs-excel-vs-app-for-invoices","Word or Excel for Invoices? Why Both Are Costing You Time","https://smashinvoices.com/blog/word-vs-excel-vs-app-for-invoices"
"xero-quote-builder-gmail-extension","Fastest Xero Quote Builder for Gmail — Chrome Extension | SMASH","https://smashinvoices.com/blog/xero-quote-builder-gmail-extension"
"xero-too-complicated-sole-trader","Is Xero Too Complicated for a One-Person Trades Business?","https://smashinvoices.com/blog/xero-too-complicated-sole-trader"